"--12f00d0145597481","Гелловін"
"--2ea01d11a8a82709","Never get into politics.$NL;$NL;The Payday Gang has rocked Washington to its very foundations, and a bugged conversation between two agents hints that a reckoning is just around the corner. $NL;$NL;Head to the Lost Tapes menu and steal this secret recording!"
"--35167927db02cf7b","Gamesight"
"--37d5d0da19d1f30f","Telemetry is completely anonymous and shows us how people play the game, which heists are the most popular, which objectives are too hard or too easy, things like that. This helps us make the game even better.$NL;$NL;Telemetry is optional, and you can disable it at any time in the Advanced options."
"--49559d23ba99741e","Lost Tape: Enemies Of The State"
"--6cc8ac044229f21d","Disable Telemetry"
"--6e16550488fe919c","Lost Tape: Keeping Up With The Garnets"
"--708aa69bf2189cb2","Gamesight"
"--7c224b921088cbc0","Decline and Close Game"
"--81297ba2c08fb8a3","Privacy Policy for Payday 2"
"--845e40442caaf833","Actions have consequences, even for the Payday Gang.$NL;$NL;As GenSec Industries faces a financial crisis, a wiretapped phone call reveals who has the most to lose...and who they'll blame for that loss.$NL;$NL;Head to the Lost Tapes menu and steal this secret recording!"
"--84e133afa4a8bf5f","A decade of PAYDAY 2?! How time flies! It's been a joy heisting with you all for these ten wonderful years, and to celebrate, we're bringing the Piggy Bank back in a big way!$NL;$NL;You'll find the Piggy in any heist on this event's CRIME.NET page. Usually hanging out near the beginning or end of the heist, on rooftops, and any wide-open spaces. Feed it Piggy Bucks to make it grow; you can earn a bag of Piggy Bucks after ten normal kills, five headshot kills, five Cash Blaster kills, or one kill with an Anniversary Weapon.$NL;$NL;The first bag of Piggy Bucks will awaken the Piggy Bank into Stage 1, and you can grow the Piggy all the way up to Stage 5. Whenever the Piggy levels up, it will reward your team with powerful buffs to keep those Piggy Bucks coming. But beware: leveling up will also spawn a terrifying new enemy...The Warthog! This special Dozer is a beast, but he's vulnerable to Anniversary Weapons. Remember that.$NL;$NL;When you've had your fill, break the Piggy Bank and then escape the heist alive.The larger the Piggy grew, the more bonuses you'll receive in cash, XP, loot drops, and Continental Coins. You can also earn more goodies through the 10th Anniversary Side Jobs!$NL;$NL;Now, get out there and make that Piggy proud!"
"--8cf42e9b5ebce968","Behind every threat is a bigger, more dangerous threat.$NL;$NL;Through routine audio surveillance in a D.C. prison, the survivor of an infamous shootout alludes to a mysterious foe targeting the Payday Gang. $NL;$NL;Head to the Lost Tapes menu and steal this secret recording!"
"af3ce5c76f891112","Діаманти вічні, але розум легко зламати.$NL;$NL;Прихований запис проливає світло на чвари між діамантовим магнатом і його сином, а також на те, як злочини Банди Payday довели їх обох до межі божевілля.$NL;$NL;Заходьте в меню Lost Tapes і викрадіть цей таємний запис!"
"cacd98a9e4dda31a","Втрачена платівка: Погано Для Бізнесу"
"d01257ebc5921038","Телеметрія"
"d5ac68f1c2b3487c","Payday 2 10-а Річниця"
"dfaa13f9c9f5013a","Втрачена платівка: Співкамерники"
"dialog_a10th_event_text","Знищення спеціальних підрозділів створює повітряні кулі, які можна підстрелити, щоб дати всій команді бонус, який буде або прямим покращенням, або тимчасовим, залежно від того, який підрозділ знищено. Деякі підрозділи частіше створюють кулі, ніж інші. Одночасно може бути активним кілька бонусів."
"dialog_a10th_event_title","10-й Ювілейний захід"
"dialog_abort_mission_text","Ви впевнені, що хочете завершити поточний контракт?$NL;$NL;Ви та ваша команда будуть повернуті в фазу планування, де можна вибрати новий контракт."
"dialog_abort_weapon_color_customize","Ви впевнені, що бажаєте повернутися без застосування конфігурації?"
"dialog_accept","Прийняти"
"dialog_accept_changes","Ви бажаєте зберегти ці налаштування дисплея? Вони будуть повернуті в $TIME;."
"dialog_accept_changes_title","ПІДТВЕРДИТИ ЗМІНИ?"
"dialog_account_picker","Перемикання профілів може призвести до втрати незбереженого прогресу. Бажаєте продовжити?"
"dialog_age_restriction","Онлайн-сервіс відключено на вашому обліковому записі Sony Entertainment Network через обмеження батьківського контролю."
"dialog_allocate_skillpoint","Це розблокує $skill; навичку.$NL;$NL;Це коштуватиме $cost; і $points; з $remaining_points; очок."
"dialog_apply","Застосувати"
"dialog_are_you_sure_you_want_leave","Ви впевнені, що хочете вийти з цього лобі?"
"dialog_are_you_sure_you_want_leave_cs","Ви впевнені, що хочете покинути це лобі?$NL;$NL;Ваша злочинна діяльність буде призупинена, доки ви її не продовжите."
"dialog_are_you_sure_you_want_stop_cs","Ви впевнені, що хочете зупинити Серію Злочинів?$NL;$NL;Це закінчить вашу поточну Серію Злочинів, і жодна винагорода не буде надана."
"dialog_are_you_sure_you_want_stop_cs_refund","Ви впевнені, що хочете зупинити Серію Злочинів?$NL;$NL;Це завершить поточну сферу, і жодна винагорода не буде видана вам. Ваша початкова інвестиція з $coins; Континентальні Монети будуть повернуті до вас."
"dialog_are_you_sure_you_want_to_clear_progress","Ви впевнені, що хочете очистити свій прогрес? Це скине вашу готівку, рівень репутації та ваш інвентар."
"dialog_are_you_sure_you_want_to_leave_game","Ви дійсно хочете покинути поточну гру?"
"dialog_are_you_sure_you_want_to_leave_game_crime_spree","Ви впевнені, що хочете покинути поточну гру?$NL;$NL;Це призведе до того, що ваша гра Crime Spree завершиться невдало, і ви повинні заплатити, щоб продовжити її або отримати нагороди у лобі Crime Spree."
"dialog_are_you_sure_you_want_to_quit","Ви впевнені, що хочете вийти?"
"dialog_are_you_sure_you_want_to_reset_statistics","Ви точно хочете скинути статистику?"
"dialog_ask_load_progress_backup_corrupt","Прогрес профілю пошкоджений. Завантажити з резервної копії? Обравши НІ видалиться ваш прогрес."
"dialog_ask_load_progress_backup_low_lvl","Ваше локальне резервне копіювання новіше, ніж збереження в хмарі.$NL;$NL;Натисніть ТАК, якщо ви хочете завантажити локальну резервну копію."
"dialog_ask_load_progress_backup_wrong_version","Прогрес профілю неправильної версії. Завантажити з резервної копії? Обравши НІ видалиться ваш прогрес."
"dialog_ask_save_progress_backup","Зберегти резервну копію?"
"dialog_assets_buy_title","Ви впевнені?"
"dialog_authentication_fail","Steam не вдалося автентифікуватись з вашим Steam ID."
"dialog_authentication_host_fail","Steam не зміг автентифікувати Steam ID для хоста."
"dialog_blackmarket_abort_mask_warning","Ваша маска не була закінчена. В разі відмови маска залишиться незмінною."
"dialog_blackmarket_assemble_item","Ви дійсно хочете з'єднати $item, маску та розмістити її в інвентарі?$NL;$NL;$num_in_inventory;"
"dialog_blackmarket_buy_item","Ви дійсно бажаєте придбати $item;?$NL;$NL;Це буде коштувати вам $money;.$NL;$NL;$num_in_inventory;"
"dialog_blackmarket_buy_mask_slot","Купівля цього слота розблокує ще одну маску.$NL;$NL;Це коштуватиме вам $money;."
"dialog_blackmarket_buy_weapon_slot","Купівля цього слота розблокує ще одну зброю.$NL;$NL;Це коштуватиме вам $money;."
"dialog_blackmarket_finalize_item","$ITEM;$NL; Ви збираєтеся завершити кастомізацію, цей процес незворотній і буде коштувати вам $money;."
"dialog_blackmarket_item","$item;"
"dialog_blackmarket_lost_mods_warning","(Ваші видалені модифікації будуть розміщені в інвентарі)"
"dialog_blackmarket_mask_sell_mod_readded","$mod; повернеться до вашого інвентарю."
"dialog_blackmarket_mod_add","Ви збираєтеся додати модифікацію $mod; на свою зброю."
"dialog_blackmarket_mod_conflict","Ці модифікації несумісні та будуть видалені:$mods;"
"dialog_blackmarket_mod_cost","Це буде коштувати вам $money;."
"dialog_blackmarket_mod_remove","Ви збираєтеся зняти модифікацію $mod; зі своєї зброї."
"dialog_blackmarket_mod_replace","Це замінить вашу поточну модифікацію $mod;"
"dialog_blackmarket_num_in_inventory","У вас уже є $amount, $item."
"dialog_blackmarket_slot_item","[СЛОТ $slot;] $item;"
"dialog_blackmarket_slot_item_sell","Якщо ви це продасте, вам буде сплачено $money;."
"dialog_blackmarket_slot_mask_remove","Повернути цю маску назад до вашого сховища? $suffix;"
"dialog_blackmarket_slot_mask_remove_suffix","Кастомізація буде продана за $money;."
"dialog_bm_crafted_sell_title","Ви впевнені?"
"dialog_bm_mask_assemble_title","Ви впевнені?"
"dialog_bm_mask_custom_abort","Ви впевнені?"
"dialog_bm_mask_custom_final_title","Ви впевнені?"
"dialog_bm_mask_sell_title","Ви впевнені?"
"dialog_bm_weapon_buy_title","Ви впевнені?"
"dialog_bm_weapon_modify_title","Ви впевнені?"
"dialog_buy_weapon_message","Хочете придбати зброю ''$WEAPON;'' за $COST;?"
"dialog_buy_weapon_title","Купити"
"dialog_can_become_infamous_desc","Ви виконали умови для отримання наступного рангу Неслави. Щоб стати безславним, натисніть '$become_infamous_menu_item;' в інвентарі."
"dialog_cant_continue_cs_text","Ви не можете продовжувати свій злочин через нестачу континентальних монет. Для того, щоб продовжити роботу від $level;$BTN_SPREE_TICKET; вам потрібні $cost; Континентальні монети."
"dialog_cant_continue_cs_title","Це не можливо продовжити"
"dialog_challenge_warn_choose_reward","Це нагорода, яку ви хочете?$NL;$reward;"
"dialog_challenge_warn_choose_reward_title","Ви впевнені?"
"dialog_cheated_host","Не вдалося грати на сервері з чітами."
"dialog_connect_controller_text","Немає Бездротового Контролера, Будь Ласка Повторно Підключіть Контролер"
"dialog_connect_controller_text_NX64","Будь ласка, під'єднайте контролер до Nintendo Switch."
"dialog_connect_controller_text_WIN32","Будь ласка, під'єднайте контролер."
"dialog_connect_controller_text_X360","Будь ласка, повторно підключіть безпровідний контролер Xbox One та натисніть $BTN_A;."
"dialog_connect_controller_title","Немає бездротового контролера"
"dialog_connect_controller_title_NX64","Контролер від'єднано"
"dialog_connect_controller_title_WIN32","Без контролера"
"dialog_connect_controller_title_X360","Контролер від'єднано"
"dialog_connecting_inet_title_NX64","З'єднання..."
"dialog_connection_to_host_lost","Підключення до хоста втрачено"
"dialog_continue","Продовжити"
"dialog_continue_cs_text","Ви хочете продовжити свою Серію Злочинів?$NL;Це дозволить вам продовжити свою Серію Злочинів від $level;$BTN_SPREE_TICKET; щоб отримати ранги Серії Злочинів та накопичити більші нагороди.$NL;$NL;Це буде коштувати вам $cost; Континентальні Монети."
"dialog_continue_cs_title","Продовжити Серію Злочинів"
"dialog_creating_lobby_title","Створення гри"
"dialog_cs_cant_claim_rewards_text","У вас немає нагород, щоб отримати."
"dialog_cs_claim_rewards","Отримати нагороди"
"dialog_cs_claim_rewards_text","Ви впевнені, що хочете отримати нагороду за Серію Злочинів?$NL;$NL;Це закінчить ваше поточне лобі Серії Злочинів, і вам доведеться почати нову, щоб отримати винагороди."
"dialog_cs_crash_fail","Серія Злочинів Провалилася"
"dialog_cs_crash_fail_text","Ваша Серія Злочинів провалилася через несподіване закриття гри.$NL; Ви все ще можете заплатити Континентальні Монети, щоб продовжити."
"dialog_cs_ga_already_purchased","Вже придбано"
"dialog_cs_ga_already_purchased_text","Ви можете придбати лише один Gage Boost за одну місію Crime Spree."
"dialog_cs_ga_in_progress","Грабування В Процесі"
"dialog_cs_ga_in_progress_text","Покращення Ґейджа неможливо придбати після запуску місії."
"dialog_default_options_message","Ви хочете скинути всі параметри до стану за замовчуванням?"
"dialog_default_options_title","Скинути параметри"
"dialog_demo_info_text","Дякуємо за встановлення нашої демо!$NL;$NL;В цій демо-версії PAYDAY 2, ви можете підняти рівень персонажу до 10. Зверніть увагу, що збереження файлу для демо-версії не може бути перенесено до повної гри.$NL;$NL;Ми в команді OVERKILL сподіваємось, що вам сподобається ця демо. Якщо вам подобається те, що ви бачите, ви можете купити PAYDAY 2, де ви можете отримати більше рівнів через нашу систему Безчесті. У повній грі також більше контенту на кшталт більшої кількості пограбувань, зброї, масок і більше.$NL;$NL;- Команда OVERKILL"
"dialog_demo_info_title","Ласкаво просимо до демо PAYDAY 2!"
"dialog_dlc_require_restart","Попередження"
"dialog_dlc_require_restart_desc","Потрібно перезавантажити PAYDAY 2, щоб отримати доступ до нових предметів."
"dialog_does_not_own_heist","Ви не володієте цим пограбуванням та не можете приєднатися до цього сервера."
"dialog_does_not_own_heist_info","Пограбування ''$HEIST;'' не може бути відтворене з гравцем $PLAYER;."
"dialog_dropin_title","$USER; приєднується до гри"
"dialog_err_cant_join_from_game","Ви повинні вийти з поточної гри, перш ніж приєднатися до нової."
"dialog_err_failed_creating_lobby","Не вдалося створити гру."
"dialog_err_failed_joining_lobby","Не вдалося приєднатися до гри."
"dialog_err_failed_searching_lobbys","Помилка отримання ігор."
"dialog_err_not_signed_in","ВИ ПОВИННІ БУТИ В МЕРЕЖІ ЩОБ ВИКОРИСТОВУВАТИ РЕЖИМИ МЕРЕЖНОЇ ГРИ"
"dialog_err_not_signed_in_PS3","Для використання режимів мережі, увійдіть до 'Playstation Network''."
"dialog_err_not_signed_in_X360","Ви не ввійшли в Xbox Live, або у вас немає необхідних прав для доступу до функцій Xbox Live."
"dialog_err_room_allready_joined","Ви вже приєдналися до цієї кімнати."
"dialog_err_room_is_closed","Ця кімната закрита, будь ласка, спробуйте іншу."
"dialog_err_room_is_full","Ця кімната була сформована, будь ласка, спробуйте іншу."
"dialog_err_room_is_full_NX64","Ця кімната була сформована, будь ласка, спробуйте іншу."
"dialog_err_room_is_full_X360","Ця кімната була сформована, будь ласка, спробуйте іншу."
"dialog_err_room_no_longer_exists","Ця кімната більше не існує, будь ласка, спробуйте іншу."
"dialog_err_room_no_longer_exists_NX64","Ця кімната більше не існує, будь ласка, спробуйте іншу."
"dialog_err_room_no_longer_exists_X360","Ця гра більше не існує, будь ласка, спробуйте іншу."
"dialog_err_wrong_version_message","У грі, до якої ви намагаєтеся приєднатися, використовується інша версія PAYDAY 2. Ви не можете приєднатися."
"dialog_error_title","Помилка"
"dialog_external_items_prefix_desc","Спеціальні предмети були переміщені в ваш інвентар!"
"dialog_external_items_title","Новий імпортований трофей"
"dialog_fail_load_dlc_corrupt","Виявлено пошкоджений вміст завантаження. Будь ласка, зайдіть у розділ Пам'яті Панелі Інструментів, видаліть пошкоджений вміст і завантажте його знову."
"dialog_fail_load_game_corrupt","Файл збереження пошкоджено. Неможливо завантажити гру."
"dialog_fail_load_progress_corrupt","Прогрес пошкоджено. Тепер дані буде видалено."
"dialog_fail_load_progress_corrupt_retry","Не вдалося завантажити прогрес. Спробувати завантажити ще раз?"
"dialog_fail_load_progress_wrong_version","Версія системи прогрес-файлу неправильна. Версія $VERSION; або вищезазначена - необхідна. Дані тепер будуть видалені."
"dialog_fail_load_progress_wrong_version_WIN32","Неправильна версія прогрес-файлу. Дані буде видалено."
"dialog_fail_load_progress_wrong_version_retry","Неправильна версія прогрес-файлу. Версія $VERSION; або вищезазначена - необхідна. Спробувати завантажити ще раз?"
"dialog_fail_load_setting_corrupt","Файл налаштувань пошкоджено. Дані тепер будуть видалені."
"dialog_fail_load_setting_corrupt_retry","Пошкоджений файл налаштувань. Спробувати ще раз?"
"dialog_fail_load_setting_wrong_version","Файл налаштувань неправильної версії. Версія $VERSION; або вище - необхідна. Дані тепер буде видалено."
"dialog_fail_load_setting_wrong_version_WIN32","Файл налаштувань неправильної версії. Дані тепер буде видалено."
"dialog_fail_load_setting_wrong_version_retry","Файл налаштувань неправильної версії. Версія $VERSION; або вище - необхідна. Спробувати завантажити знову?"
"dialog_fetching_status_title","Оновлення онлайн-стану."
"dialog_gage_assignment_completed","From: Gage [gage@///REDACTED///]$NL;To: $player;$NL;Date: $date; $time;$NL;Subject: GAGE COURIER ASSIGNMENTS$NL;$NL;GOOD JOB!$NL;$NL;Well done, $player;. Thanks for collecting the packages. It's time to get your reward. Go to your inventory and you will find the content of the following packages:$NL;$completed;$NL;$NL;- Gage"
"dialog_gage_assignment_completed_title","У ВАС НОВЕ ПОВІДОМЛЕННЯ"
"dialog_game_is_installing","Не можна приєднатися до запрошення. Спробуйте ще раз, коли гра завершить встановлення."
"dialog_game_is_installing_menu","Ця частина заголовка ще не була встановлена. Будь ласка, спробуйте ще раз, коли встановлення буде завершено."
"dialog_game_permission_changed","Налаштування гри змінились, ви більше не маєте дозволу на приєднання"
"dialog_game_started","Наразі до гри не можна приєднатися"
"dialog_gamesight_telemetry_text","Перед початком ваших PAYDAY 2 пограбувань, ми хочемо проінформувати вас, що, граючи в гру, ви приймаєте нашу Політику Конфіденційності та нашу PAYDAY УГОДУ КОРИСТУВАЧА.$NL;$NL;Ми також хочемо знати, чи ви дозволите нам увімкнути відслідковування GAMESIGHT і ТЕЛЕМЕТРІЮ. Ці інструменти використовуються для збору інформації про гру.$NL;$NL; ТЕЛЕМЕТРІЯ абсолютно анонімна і показує, що люди грають в гру, які пограбування є найбільш популярними, які цілі занадто складні чи занадто прості, такі речі, як ці, допомагаючи нам зробити гру ще кращою.$NL;$NL; Gamesight говорить про те, як працюють маркетингові кампанії, що допомагає нам залучити нових гравців у PAYDAY 2, гарантуючи, що в наступні роки будуть нові гравці.$NL;$NL;Обидва необов'язкові, і ви можете відключити їх у будь-який час у розширених налаштуваннях."
"dialog_gamesight_telemetry_title","Ласкаво просимо до Payday 2!"
"dialog_gamesight_toggle","Увімкнути Gamesight"
"dialog_getting_world_list","Отримання світового списку"
"dialog_inactive_user_accepted_invite","Запрошення було прийняте неактивним користувачем. Запрошення успішно завершено після натискання START."
"dialog_inactive_user_accepted_invite_error","Запрошення прийнято неактивним користувачем. Запрошення буде проігноровано."
"dialog_infamous_info_desc","Ви не маєте того, що потрібно. Щоб стати безчестним, вам потрібно отримати рівень репутації $level; та сплатити плату за $cash; з вашого офшорного рахунку разом з вашими очками вміння та рештою ваших витрат готівкою."
"dialog_infamous_info_title","Безчестя"
"dialog_infamy_reseted_title","Зверніть увагу"
